Context,Keyword,Page_Number
"This form is used to open an account that shall serve as a single bank account for the deposit of all payments that are received from HUD through the Electronic Line of Control System (""eLOCCS""). A copy of the agreement form should be kept on file.",Form HUD-51999: General Depository Agreement.,13
"This form is used to establish an account with a banking institution (Depository) as a depository for funds borrowed by the TRIBE/TDHE and guaranteed under Title VI of NAHASDA, and for investment purposes for approved reserve accounts and/or NAHASDA IHBG grant funds pre-approved for investments. The funds must comply with investments prescribed by HUD. A copy of the agreement form should be kept on file.",Form HUD-52736A: Depository Agreement Banking Accounts.,13
"The purpose of form HUD-52736A is similar to HUD-52736A, except that this form shall be used when the TRIBE/TDHE uses a Broker-Dealer for investing NAHADA funds. In this agreement, the Broker/Dealer warrants and represents that it is registered as a broker-dealer under the Securities Exchange Act of 1934(15 U.S.S. 78a et seq.) with the Securities and Exchange Commission and shall be a member of the Securities Investor Protection Corporation (SIPC). A copy of the agreement form should be kept on file.",Form HUD-52736B: Depository Agreement (Brokers/Dealers):,13
"Notwithstanding the policies described earlier in this document, the TRIBE/TDHE has established a number of internal control procedures to ensure:

- The grant awards are managed to comply with statutes, regulations, and the terms and conditions of the award;
- The TRIBE/TDHE evaluate and monitor the grant awards to ensure compliance with statutes, regulations, and the terms and conditions of the award;
- The TRIBE/TDHE shall take prompt action to correct identified instances of noncompliance including noncompliance identified in audit findings;
- The TRIBE/TDHE must take reasonable measures to safeguard sensitive information and assets purchased with grant awards, consistent with privacy obligations of confidentiality of applicable federal, State, local, and tribal laws.

In addition, The TRIBE/TDHE has established written procedures to implement internal controls over cash handling and requirements for payment methods that:

- Ensure there are sufficient funds to cover payments made for program and operations activities;
- Ensure adequate internal controls are in place in the handling of cash receipts from the time of receipt to deposit in the appropriate depository or broker account;
- Establish written procedures to ensure the amount and the timing of grant award advances drawn for the purpose of paying program expenses have not been drawn unreasonably in advance of when the funds are needed for program expenses.
- Establish adequate internal controls and written procedures to ensure payments are made only for approved purposes;
- Maintain adequate accounting records for cash receipts and payments.",APPENDIX 1: EFFECTIVE INTERNAL CONTROLS AND ACCOUNTABILITY,14
"This Policy is based on the principle of separation of duties. Accordingly, no single person shall have the authority to authorize a transaction, execute a transaction, record a transaction, and have custody of any resulting assets.",A. Separation of Duties,14
1. An employee designated by the Department Director shall maintain all tenant ledgers.,B. Special Procedures Regarding Tenant Accounting,14
"2. In the event of tenant ledger adjustments, the Occupancy Specialist of the Department or his/her designee will complete an adjustment request for submission to the employee designated by the Department Director as having responsibility for tenant ledger maintenance.
3. The adjustment request shall be in writing with the proper justification noted on and/or attached with each request.
4. The employee designated by the Department Director as having responsibility for tenant ledger maintenance shall make the proper adjustment in the tenant accounting software ledger.
5. The employee designated by the Department Director as having responsibility for tenant ledger maintenance shall provide a copy of the completed adjustment report to the Occupancy Specialist to show completed tenant ledger adjustment.",General,15
"1. Payments by cash, checks and money orders (including tenant payments) may be received only by designated personnel of the Tribal Finance Department. Only tribal employees designated by the Finance Director of the TRIBE/TDHE are authorized to receive payments from residents and issue receipts.
2. Cash, checks and/or money orders shall be deposited in the bank where the TRIBE/TDHE has an approved depository agreement. Deposits shall be made no less frequently than once per week regardless of the amount accumulated.
3. When cash is retained in the office overnight, it must be stored in a locked, fireproof cabinet or safe.
4. Checks received shall immediately be stamped “For Deposit Only”.
5. A receipt shall be issued for all payments collected so there is an official record of the transactions and possible disputes are prevented.
   a. Receipts shall be assigned through the tenant accounting software system. One part shall be given to the resident and one part, having the same number, shall be provided to the employee designated by the Department Director as having responsibility for tenant ledger maintenance.
   b. Receipts shall contain, at a minimum, the following information: (1) name of the resident being credited with the payment, (2) date, (3) amount of payment and (4) method of payment (cash, check, etc.).
   c. The supply of unassigned receipts shall be adequately safeguarded and kept in the custody of designated personnel of the Finance Department of the TRIBE/TDHE.",Cash Collection Control Procedures,15
"6. A bank deposit slip shall be prepared and shall include each of the cash receipt numbers making up the deposit and complete details as to the amount of coin, currency and checks. An employee of the Finance Department of the TRIBE/TDHE (other than the employee who issued and/or previously handled the cash receipts) shall reconcile the receipts.
7. All payments shall be deposited intact with the appropriate deposit slip to provide an additional record. Under no circumstances shall any disbursements be made from payments received.
8. Payments received shall be recorded in the individual resident accounts receivable records on the day of receipt or as soon thereafter as practical, even when the money is not deposited on the same day. Cash receipt numbers shall be recorded on both the deposit slip and the resident account receivable records.
9. The employee designated by the Department Director as having responsibility for tenant ledger maintenance shall be responsible for posting the resident accounts receivable records. The Finance Director of the TRIBE/TDHE or his/her designee shall make the bank deposits.",General,16
"1. The Council/Board shall approve by resolution a spending and signing authority for the Council/Board, Executor Director, Finance Director and department managers to identify and enable authorized personnel to:
   a. Procure products and services through requisitions, check requests, or credit card services.
   b. Sign contracts and change orders for an authorized amount.
   c. Receive grants.
   d. Sign checks.
2. All checks require two authorized signatures. The Finance Director shall oversee the proper notification of the TRIBE/TDHE banks whenever authorized signature changes are made.
3. All debts representing allowable and authorized costs shall be paid promptly upon receipt of proper invoices/billing statements.
4. All disbursements shall be made by check. The Executive Director may approve other forms of disbursement, such as wire or electronic funds transfers.
   a. All checks shall be pre-printed and shall bear the name and address of the TRIBE/TDHE.",D. Cash Disbursement Control Procedures,16
"b. All checks must be pre-numbered and used in sequence. Voided checks must be retained and recorded.

c. The supply of unused checks shall be adequately safeguarded in a fireproof cabinet or safe.

5. The employee designated by the Finance Manager shall initiate each transaction by completing a “check request” form, which shall be presented to the Finance Manager for approval. All check request forms shall contain enough narrative description to specifically identify the purposes of the payment and the account to which the cost is to be charged.

6. The Finance Manager shall review the check requests and attached supporting documentation for completeness and accuracy. The Finance Manager shall ensure that the vendor’s invoice/billing statement accords with the terms of the purchase, that the goods have been received and conform to specifications or that the services billed have been rendered satisfactorily, that discounts or other adjustments of the amounts billed are in order, that the computations and accounts to be charged are correct and that sufficient funds are available for payment. The Finance Manager shall then submit the checks and supporting invoices for processing.

7. The Finance Director of the TRIBE/TDHE or his/her designee shall prepare checks.

8. Checks shall never be written for “cash.”

9. Checks shall not be signed or countersigned in advance of being completely filled out. Each check shall be accompanied by adequate supporting documentation, including invoices, travel vouchers, etc.

10. All checks shall require the signature of at least two (2) individuals properly authorized by the TRIBE/TDHE.

11. Whenever possible, no individual shall sign a check on which he/she is the payee.

12. Check signers shall review each check carefully and shall not sign any check that lacks appropriate supporting documentation or exhibits signs of alteration. If it is necessary to change a check, the check must be voided and a new check issued.

13. The signed check shall be mailed or delivered to the payee by the Accounts Payable Clerk of the TRIBE/TDHE or his/her designee.

14. The Finance Director of the TRIBE/TDHE or his/her designee shall reconcile bank statements of the Department. Discrepancies between any books of

May 3, 2016 DRAFT – Pending HUD Legal Counsel Review",General,17
"1. The TRIBE/TDHE shall have written authorizations on file for all employees that cover their rates of pay, withholdings and deductions.
2. The Finance Manager or his/her designee shall establish adequate timekeeping controls (including the use of time sheets) and there shall be supervisory review and approval of all employee time/leave records prior to issuance of a check.
3. The Finance Director of the TRIBE/TDHE/TDHE or his/her designee shall prepare payroll checks.",E. Special Procedures Regarding Payroll Disbursement.,18
"1. With the advice and consent of the Council/Board of the TRIBE/TDHE, credit cards may be made available to designated employees of the TRIBE/TDHE consistent with their job duties and demonstrated professional responsibility.
2. Credit cards are for authorized business expenditures of the TRIBE/TDHE and are not intended to be used by employees as a substitute for personal credit cards.
3. The Executive Director must authorize business expenses before charges are incurred on company credit card(s) in accordance with applicable TRIBE/TDHE policies, procedures and practices, including but not limited to the Travel and Training Policy and the Procurement Policy. The Executive Director may authorize valid business expenses in writing retroactively.
4. Employees shall submit receipts for all expenses charged to company credit card(s) to the Finance Director of the TRIBE/TDHE or his/her designee within one week of the transaction.
5. The Finance Director of the TRIBE/TDHE or his/her designee shall examine billings for all company credit cards to ensure that all charges are valid. If there are incorrect charges, the Finance Director or his/her designee shall notify the Executive Director immediately and shall complete and return any forms necessary to dispute such charges to the credit card company. If an employee with knowledge of an incorrect or disputable charge fails to report such charge within a reasonable time, he or she may be liable to the TRIBE/TDHE for any resultant charges and may be subject to disciplinary action up to and including termination of employment.
6. Employees who incur ineligible or disallowed costs on company credit cards shall reimburse the TRIBE/TDHE for such charges within thirty (30) calendar days of",F. Credit Card Control Procedures,18
"the date such charges were incurred and may be subject to disciplinary action up to and including termination of employment.

7. Finance charges, late fees and/or penalties associated with credit card use shall be avoided and shall not be paid with IHBG funds under any circumstances.

8. Charges shall not be incurred in excess of the credit card’s established credit limits. If a higher limit is required, a request for a new credit limit and supporting documentation shall be submitted to the Executive Director for approval.

9. Lost or stolen credit cards shall be reported to the TRIBE/TDHE and to the credit card company immediately and not later than the first business day after discovery of the loss. Employees who fail to report lost or stolen credit cards may be held liable for any charges and may be subject to disciplinary action up to and including termination of employment.

10. Employees shall surrender company credit card(s): (1) upon demand by the TRIBE/TDHE, (2) when there is no longer a business need for the card and/or (3) upon termination of employment. Cancelled credit cards shall be returned immediately to the TRIBE/TDHE and properly destroyed. Surrender or cancelation of a credit card does not discharge any responsibilities incurred up to and including the date of such action.",General,19
"1. Subject to the approval of HUD and the Council/Board, IHBG funds may be drawn from eLOCCS to be invested by the TRIBE/TDHE. A copy of the resolution authorizing each investment transaction shall be maintained in the official records of the Tribe/TDHE, with a copy provided to the Finance Director of the TRIBE/TDHE.

2. Any and all investment documents shall be kept in the custody of the Finance Director of the TRIBE/TDHE or his/her designee. Investment documents shall be safeguarded in a fireproof cabinet or safe, and shall be stored separately from other accounting records.

3. Investments shall be made only in the name of the TRIBE/TDHE, and shall be maintained in a custodian or trust account. The General Depository Agreement (Form HUD-52736B) shall be executed by a representative of the TRIBE/TDHE and the depository. An original HUD-52736B shall be maintained by the financial institution and the Finance Department of the TRIBE/TDHE.

4. Investments shall be recorded in detail in an investment ledger, which shall reflect any and all interest earned, collected and/or disbursed.",G. Investment Control Procedures,19
"5. The Finance Director of the TRIBE/TDHE or his/her designee shall reconcile the investment ledger on a monthly basis, and shall provide a report regarding investment performance to the Council/Board on a quarterly basis. Discrepancies shall be reported to the Executive Director and/or the Council/Board, promptly investigated and resolved.

6. The Finance Director of the TRIBE/TDHE or his/her designee shall maintain a maturity schedule evidencing that the proposed investments will mature on the approximate dates the funds will be needed and that investment maturity dates do not exceed five (5) years from the date the funds are drawn down for investment purposes from the LOCCS or such longer period as may be permitted by HUD.

May 3, 2016 DRAFT – Pending HUD Legal Counsel Review",General,20
"I. PURPOSE: In accordance with NAHASDA 1000.56:

a. Each year, funds shall be paid directly to recipients (Tribe/TDHE) in a manner that recognizes the right of Indian self-determination and tribal self-governance and the trust responsibility of the Federal government to Indian tribes consistent with NAHASDA.

b. Payments shall be made as expeditiously as practicable.
As a federal grant, the NAHASDA funds must comply with the Uniform Guidance requirement cited in 200.302(6), which requires written procedures to implement the requirements of 200.305 Payments. The written procedures on 200.305 Payments are part of the Tribes/TDHE’s Financial Management Policy.

GRANT DRAWDOWN: Recipients of NAHASDA federal grant funds must draw funds following HUD’s specific procedures, with the use of eLOCCS system, which is HUD’s primary grant and subsidy disbursement system that handles disbursement and cash management for the majority of HUD grant programs, including IHBG, ICDBG, and NHHBG funds. Only eligible NAHASDA program expenses are paid with IHBG grant funds.

To access eLOCCS, the Tribe/TDHE must register in Secure Systems to access the eLOCCS online.

1. Submit a HUD-27054 LOCCS Access Authorization form, which will specify the Business Partner(s) and HUD Programs you are authorized to access within eLOCCS. Each eLOCCS user must submit a HUD-27054.

- The form specifies the Business Partner(s) and HUD Programs the user is authorized to access within eLOCCS.
- A Tribe may allow multiple authorized users to query or draw down funds.
- The form is to be approved by the recipient’s or grantee’s Executive Director, Administrator or the President of the Tribe.
- Keep a copy and send a NOTARIZED copy to HUD.

2. HUD – 50080-IHBG: LOCCS/VRS PAYMENT VOUCHER.",APPENDIX 2: PROCEDURES TO IMPLEMENT THE REQUIREMENTS OF 200.305 PAYMENT,21
"In eLOCCS, fill out and transmit form HUD-50080 online to request a grant advance or reimbursement of eligible NAHASDA expenses.",General,22
"To prepare the Payment Voucher and ensure proper documentation:

a. make a list of vendor invoices and amounts to be paid;
b. use the list and copies of the invoices as supporting documentation for the eLOCCS draw; and
c. staple copies of the invoices to the HUD 50080 form that has the total amount requested, and file.",The LOCCS Program Area = IHBG Program Name = INDIAN HOUSING BLOCK GRANT,22
"The NAHASDA program regulations (1000.58) allow Tribes/TDHEs to receive advance payments of their entire IHBG block grant for the purpose of investing grant funds.

1. To be eligible to receive the entire IHBG block grant funds in advance for investment purposes, the Tribe/TDHE must demonstrate to HUD that it has adequate administrative capacity, demonstrated with the following:

a. Annual audits were completed timely and submitted to the Federal Audit Clearinghouse in accordance with 2 CFR 200.512;

b. There are no unresolved significant and/or material monitoring or audit findings or exceptions in the most recent annual audit completed under the Single Audit Act or in an independent financial audit prepared in accordance with generally accepted auditing principles; and

c. It is a self-governance Indian tribe or is a Tribe/TDHE that has demonstrated the administrative capacity and controls to responsibly manage the investment.

2. The Tribe/TDHE’s financial management system must comply with 200.302(b), demonstrated with the following:

a. A written financial management policy;
b. A written investment policy that outlines investments in HUD approved investment vehicles, with maturities of 5 years or less;
c. No outstanding findings as a result of a HUD audit, Inspector General audits, or HUD Monitoring review;",II. ADVANCE IHBG BLOCK GRANT PAYMENT FOR INVESTMENT PURPOSES:,22
"d. No other issues documented by the Area ONAP.

3. Invested IHBG funds must be held in one or more accounts separate from other funds for the Tribe/TDHE. Each investment fund account must be subject to a depository agreement approved by HUD. The Tribe/TDHE shall use the following HUD approved depository agreements:
   a. Form HUD-52736A (11/2013): For investments held in bank accounts;
   b. Form HUD-52736B (11/213): For investments managed by brokers/dealers.

4. The Tribe/TDHE must invest in interest bearing accounts and in eligible investment instruments pursuant to 24 CFR 1000.58, which consist of:
   a. Obligations of the United States;
   b. Obligations issued by Government sponsored agencies;
   c. Securities that are guaranteed or insured by the United States;
   d. Mutual (or other) funds registered with the Securities and Exchange Commission with invest only in obligations of the Unites States or securities that are guaranteed or insured by the United States.

The Tribe/TDHE must also maintain a schedule of investments and should track revenues and earned interest, fees, and maturity dates.

5. Invested advance payments must be insured by the United States or fully collateralized to ensure protection of the funds, even in the event of bank failure. Collateralization shall consist of identifiable U.S. Government securities as prescribed by HUD and specific authority contained in the agreement permitting HUD to exercise its rights pursuant to 24 CFR § 1000.60.

6. The Tribe/TDHE is exempted from maintaining advance payments in interest bearing accounts if:
   a. The Tribe/TDHE receives less than $120,000 in federal awards per year;
   b. The best reasonably available interest-bearing account would not be expected to earn interest in excess of $500 per year;
   c. The depository requires an unreasonably high minimum average or balance for the Tribe/TDHE to maintain.",General,23
"Tribes/TDHEs who are not eligible, or who do not choose to receive payment on their entire IHBG grant funds in advance for investment purposes, may request",III. ADVANCE PAYMENT REQUEST FOR INCURRED EXPENSES:,23
"advance payment via eLOCCS for eligible expenses incurred, but not yet paid for by the Tribe/TDHE. The requests may be made as often as is needed with eLOCCS.

The timing and amount of the advance payments must be as close as is administratively feasible to the actual disbursements by the Tribe/TDHE for eligible program expenses that have been incurred, but not yet paid. To ensure timely distribution of funds, the Tribe/TDHE should request IHBG funds from eLOCCS after invoices have been verified and have been successfully processed and ready for payment. Once the funds are received, the Tribe/TDHE will be able to distribute payment to the vendors right away.",General,24
"The Tribe/TDHE may seek reimbursement for incurred, eligible expenses in two ways:

a. eLOCCS REQUEST FOR EXPENSE REIMBURSEMENT: The Tribe/TDHE may make reimbursement requests through the eLOCCS as often as it needs the funds to reimburse itself for eligible expenses incurred and paid for with available working capital.

b. IHBG INVESTMENT WITHDRAWAL FOR EXPENSE REIMBURSEMENT: If the Tribe has been approved to draw down its entire IHBG funds for investment, it will periodically need to draw from the investment account to pay for the NAHASDA related expenses it has incurred.

c. REIMBURSEMENT PROCEDURES: The Tribe/TDHE general ledger should be set up to account for specific program expenses. On a periodic basis (for example, weekly or monthly) the Finance department runs a schedule of NAHASDA Revenue and Expense report to determine the amount of IHBG grant funds that have been recorded to offset eligible NAHASDA expenses. Because the Tribe/TDHE seeks reimbursement after incurring and recording the program expenses, the difference between the recorded IHBG grant revenues and the recorded total eligible IHBG expenses is the amount of program expenses that the Tribe/TDHE needs to be reimbursed, either through eLOCCS or by drawing down from the IHBG investment account.",IV. REIMBURSEMENT PAYMENTS,24
The Tribe/TDHE is not required to expend retained program income before drawing down or expending IHBG funds. IHBG program income may be used for any housing or related activity and is not subject to other,V. PROGRAM INCOME USE,24
federal regulations. The Tribe/TDHE must account for program income and must report program income on HUD Form 425.,General,25
,APPENDIX 3: ALLOWABLE COSTS POLICY AND PROCEDURES TO IMPLEMENT THE REQUIREMENTS OF 200.302(B)(7),25
"In accordance with NAHASDA regulation at 1000.26, Tribe/TDHE must comply with the requirements of Title 2 CFR 200 Uniform Guidance in regards to the administrative requirements and principles for determining allowable costs applicable to the administration of the IHBG award.

A Tribe/TDHE’s financial management system, in accordance with 200.302(b)(7), must include written procedures for determining the allowability of costs in accordance with Subpart E – Cost Principles. This policy and procedures define the allowable costs on the use of the IHBG grant for the Tribe/TDHE and the sub-recipients. Costs include allowable direct and allocable indirect costs.",I. PURPOSE,25
"Allowable costs are those that:

- are necessary and reasonable;
- are allocable;
- conform to any limitations or exclusions in the IHBG award;
- consistent with policies and procedures;
- follow accounting practices and standards;
- treated consistently throughout the IHBG program;

The Finance Director and program directors are responsible for monitoring the IHBG award and that all costs charged to their program budgets are accurate.",II. DETERMINING ALLOWABLE COSTS,25
