Context,Keyword,Page_Number
"Direct costs are those costs that can be identified specifically with a particular Federal award, such as IHBG, or other internally or externally funded activity, or that can be directly assigned to such activities relatively easily with a high degree of accuracy. Whether a cost is considered Direct or Indirect is determined by the Federal program and what it typically considers to be a direct cost versus indirect costs. The Tribe/TDHE should determine what costs it considers to be a direct cost or indirect cost and apply treatment of those costs consistently.",III. DIRECT COSTS,25
"Indirect Facilities and Administration (F&A) costs are incurred for common or joint objectives and not readily assignable or cannot be identified specifically with a particular project without effort disproportionate to the results achieved.

Typical examples of indirect (F&A) costs for many nonprofit organizations may include depreciation on buildings and equipment, the costs of operating and maintaining the office building, and general administration and general expenses, such as the salaries and expenses of executive officers, personnel administration, and accounting.",IV. INDIRECT (F&A) COSTS:,26
"With respect to the items of costs listed in 2 CFR 200.407 that require prior approval, specific to NAHASDA1000.(b)(1), these costs are allowable without the prior approval of HUD to the extent that they comply with the general policies and principles of 2 CFR 200.

If a TRIBE/TDHE is awarded other federal grants that do not specifically allow written prior approval, the reasonableness and allocability of certain items of costs may be difficult to determine, therefore, in order to avoid subsequent disallowance or dispute based on unreasonableness and unallocability, 200.407 of the Uniform Guidance lists items of costs that the TRIBE/TDHE may seek prior approval in advance of the incurrence of the special or unusual costs.",V. PRIOR WRITTEN APPROVAL (PRIOR APPROVAL),26
"Specific items of costs commonly incurred in the administration of the IHBG award, what are considered allowable, unallowable, or costs that are generally unallowable, but with exceptions, are listed in Subpart E – Cost Principles: General Provisions for Selected Items of Costs from 200-420-200.475. In addition, the TRIBE/TDHE should review HUD’s guidance on items of costs it explicitly disallows under the NAHASDA program, even when the items of costs may be allowed with prior approval.",VI. ALLOWABILITY OF SPECIFIC ITEMS OF COST:,26
