Context,Keyword,Page_Number
"SAMPLE FINANCIAL MANAGEMENT POLICY AND PROCEDURES
(TRIBES/TDHE’S ADMINISTERING THE INDIAN HOUSING BLOCK GRANT)
May 3, 2016 DRAFT – Pending HUD Legal Counsel Review",General,1
"1. GENERAL PURPOSE .............................................................................................................. 3
2. FINANCIAL RESPONSIBILITIES ............................................................................................. 3
3. ACCOUNTING METHODS & STANDARDS ............................................................................ 3
4. REVENUE RECOGNITION ....................................................................................................... 4
5. EXPENSE RECOGNITION ....................................................................................................... 4
6. ACCOUNT RECORDS, IDENTIFICATION, AND SOURCE DOCUMENTS ............. 4
7. RECORDS AND INFORMATION MANAGEMENT ....................................................... 5
8. FINANCIAL REPORTS ............................................................................................................. 6
9. CASH MANAGEMENT POLICY ............................................................................................. 6
10. BUDGET ADMINISTRATION ................................................................................................. 7
11. PURCHASE OF GOODS AND SERVICES ......................................................................... 8
12. ALLOWABLE COSTS ............................................................................................................ 8
13. CAPITAL ASSETS ................................................................................................................... 9
14. AUDIT ...................................................................................................................................... 11
15. PETTY CASH ......................................................................................................................... 12
16. BANKING AND INVESTING SERVICES ........................................................................... 12
APPENDIX 1: EFFECTIVE INTERNAL CONTROLS AND ACCOUNTABILITY .......... 14
APPENDIX 2: PROCEDURES TO IMPLEMENT THE REQUIREMENTS OF 200.305 PAYMENT ................................................................................................................................. 21
APPENDIX 3: ALLOWABLE COSTS POLICY AND PROCEDURES TO IMPLEMENT THE REQUIREMENTS OF 200.302(B)(7) .......................................................................... 25

May 3, 2016 DRAFT – Pending HUD Legal Counsel Review",Table of Contents,2
"The purpose of the TRIBE/TDHE’s Financial Management and Internal Controls Policy is to establish guidelines for control of the administration and implementation of the TRIBE/TDHE’s funds in accordance with the TRIBE/TDHE’s goals and objectives; to properly safeguard the assets of the TRIBE/TDHE to make sound financial decisions, and have the ability to provide accurate financial reports.

TRIBE/TDHEs are non-federal entities administering federal programs, and are therefore required to account for and present their basic financial statements according to Generally Accepted Accounting Principles (GAAP) standards set by the Governmental Accounting Standards Board (GASB).

This Policy governs the financial management system of the TRIBE/TDHE and complies with the provisions of Title 2, Part 200 of the Uniform Administrative Requirements, Cost Principles, and Audit Requirements for Federal Awards (“Uniform Grant Guidance”).",GENERAL PURPOSE,3
"This policy and any later changes shall be submitted to the [Tribal Council or Board of Commissioners] (“Board”) for approval. The Council/Board is responsible for ensuring that any policy to be adopted is appropriate for the TRIBE/TDHE.

The Council/Board appoints and delegates financial and budget authority to the Executive Director and the Finance Manager. The Finance Manager oversees the day-to-day financial management activities of the TRIBE/TDHE’s funds, ensuring the accuracy of the accounting records, internal controls are in place and adhered to, financial reports are prepared and communicated to the Executive Director timely.

The Finance Manager, is responsible for the preparation and maintenance of the accounting software’s chart of accounts, maintenance of the general ledger, reconciliation of subsidiary system accounts such as cash management, accounts payable, accounts receivable, job costing, payroll, journal entries, and responsibility of preparing required reports for compliance with the Internal Revenue Service (IRS), State and Federal grant reporting requirements.",FINANCIAL RESPONSIBILITIES,3
"Accounting methods employed by the TRIBE/TDHE shall, at a minimum, satisfy such requirements as may be prescribed by federal or state laws, regulations or guidelines. Additional accounting methods shall be employed to satisfy applicable government accounting standards promulgated by such competent authoritative",ACCOUNTING METHODS & STANDARDS,3
"May 3, 2016 DRAFT – Pending HUD Legal Counsel Review",General,3
"Revenue shall be recognized in the accounting period in which they are earned and measurable. The TRIBE/TDHE’s major revenue categories are:

- **Governmental Grants**: Federal, State, and Local: These revenue types are recognized in accordance with the legal and contractual requirements of the specific programs. Grant revenues are recognized based on expenditures recorded.
- **Unrestricted Donations and Contributions**: Revenues are recognized when received.
- **Rental Income**: Revenues are recognized when earned, based on monthly billings to residents.
- **Other Income**: Revenues are recognized as earned.
- **Interest and Dividend Income**: Revenues from interest and dividend income from cash and investments, and interest from mortgage loans issued to borrowers are recognized when earned.
- **Gain/Loss on sale of assets**: A gain or loss is recognized when an asset is sold or disposed of.",REVENUE RECOGNITION,4
"Expenses are generally recognized in the accounting period in which they are incurred, when measurable. Exceptions to this general rule include:

- **Prepaid Expenses**: Expenses are recognized as they are used or consumed.
- **Capital Assets**: Assets are recorded at historical costs and expensed through depreciation over the useful life of the assets.",EXPENSE RECOGNITION,4
"In the administration of federal, state and local government awards, the TRIBE/TDHE’s financial management system must be set up so that it can provide for the following:

The TRIBE/TDHE must maintain adequate accounting records that are supported by source documents which are the basis for the accounting transactions that are","ACCOUNT RECORDS, IDENTIFICATION, AND SOURCE DOCUMENTS",4
"entered into the TRIBE/TDHE’s accounting system. Examples include checks, invoices, copies of checks and receipts, timesheets, etc.

The TRIBE/TDHE must maintain records which adequately identify the source and application of funds provided. For example:

a. Federal Awards: All Federal awards received and expended by the TRIBE/TDHE must be properly identified and accounted for and must include, as applicable, the Catalog of Federal Domestic Assistance (CDFA) title and number, grant identification number and year, name of the federal agency, and the name of the pass-through entity, if any.

b. State and Local Awards: All State and Local awards received and expended by the TRIBE/TDHE must be properly identified and accounted for and must include, as applicable, the title and name of the grant award, the award number and the year, and the name of the pass-through entity, if any.

The TRIBE/TDHE must maintain source documents that adequately support the grant award, authorizations, obligations, unobligated balances, assets, expenditures, income and interest.",General,5
"The TRIBE/TDHE shall apply uniform rules for the TRIBE/TDHE’s records (including financial) and information which meet legal standards and best practices for effective records and information management for existing records and yet to be created records, and shall apply to all employees and contractors who generate information for the TRIBE/TDHE. The TRIBE/TDHE shall ensure:

- Control of all the TRIBE/TDHE’s information, regardless of media form;
- Records are retained in accordance with legal, business and federal, state, and local government program requirements;
- Records are maintained and stored in a manner that is secure and accessible through the retention period;
- Appropriate safeguards are in place against illegal access, removal, loss, or destruction of the TRIBE/TDHE’s records and information;
- Disposal of records and information is performed in accordance with an approved records retention schedule.

In addition to the TRIBE/TDHE’s general records and information retention policy, the TRIBE/TDHE shall also comply with the NAHASDA program requirements on records management in accordance with 1000.552, wherein:",7. RECORDS AND INFORMATION MANAGEMENT,5
"• Records must be retained for 3 years from the end of the tribal program year during which the expenditures occurred.

• If any litigation, claim, negotiation, audit or other action involving the records has been started before the expiration of the 3-year period, the records must be retained until completion of the action and resolution of all issues which arise from it, or until the end of the regular 3-year period, whichever is later.",General,6
"The TRIBE/TDHE must be able to produce accurate, current, and complete disclosure of the financial results of each of the financially assisted activities made in accordance with the financial reporting requirements of the grant or subgrant. The TRIBE/TDHE shall use the financial reports as tools to manage, control, ensure compliance, monitor, and inform the TRIBE/TDHE on its financial activities.

a. Reports to Grant Agencies: The TRIBE/TDHE shall complete and submit all reports to Federal, State, and local grant agencies in accordance with, and in the format and timelines required by the agency. The Finance Director shall oversee all administrative and financial reports, including the HUD Standard Form 425 (Quarterly Transaction Report), the IHP and the APR, before the due dates designated by HUD, as such forms and deadlines may change from time to time.

b. Management and Council/Board reports: The TRIBE/TDHE shall prepare and make available to management and the Council/Board on a monthly basis, financial reports to include:

• Statement of Net Position.
• Statement of Revenues, Expenses, and Changes in Net Position.
• Statement of Cash Flow.
• Budget to actual reports detailing significant variances of sources and uses of funds as a management tool.",FINANCIAL REPORTS,6
"The TRIBE/TDHE recognizes the importance of cash management to insure there are sufficient funds to pay for the expenses of operating the TRIBE/TDHE’s housing programs. The Finance Director shall be responsible for monitoring the daily cash flow and balances of all cash funds, including investments.

On a monthly basis, the Finance Director shall provide a report that shows the cash position from all sources that are accounted for in the cash accounts and investment accounts, along with bank and investment statements. The",CASH MANAGEMENT POLICY,6
"TRIBE/TDHE’s cash and investment funds may be from a variety of sources such as NAHASDA IHBG funds, non-restricted funds, unused donations, and program income.

The Finance Director shall be responsible for providing monthly reports to the Executive Director, to include:

• Book cash and investment position reports;

• Cash flow projections for the following month;

• Investments statements from the depository or the broker that show the activities of the accounts, such as amounts deposited and withdrawn, investment revenues, fees, and gains or losses on investment.

If at any time, the Finance Director finds the TRIBE/TDHE in a potential cash deficiency situation, the Council/Board and the Executive Director must be notified immediately.

Any cost allocable to a particular Federal award may not be charged to other Federal awards to overcome fund deficiencies, to avoid restrictions imposed by Federal statutes, regulations, or terms and conditions of the Federal awards, or for other reasons. For example, the TRIBE/TDHE shall not divert funds between programs and/or activities, even when such programs/activities are each assisted by HUD (for example, the HUD-funded Indian Housing Block Grant (“IHBG”) and Indian Community Development Block Grant (“ICDBG”) programs.",General,7
"a. Budget Responsibility and Adoption:

The TRIBE/TDHE’s annual budget represents a financial plan for management to carry out the objectives of the TRIBE/TDHE’s affordable housing activities. The TRIBE/TDHE’s Executive Director, Finance Manager and managers are responsible for preparing the annual budget, and are responsible for presenting the annual budget to the Council/Board for final approval.

Total projected revenues or sources or uses of funds are identified and included in the annual budget, allowing for inclusion of all funding sources and all funding outlays during the budget period. In addition to grant revenue, other sources of funds, such as debts (for example, Title VI loans) are included in the annual budget to accurately portray total resources used to fund operating and capital plans in the fiscal year, and expenditure budgets for grant awards are in compliance with the grant agreement. The Council/Board approves the annual Indian Housing Plan and those approved activities are included in the TRIBE/TDHE’s annual housing program budget.",10. BUDGET ADMINISTRATION,7
"The budget process should begin early in the fiscal year to allow the Executive Director, the Finance Director, and the department managers to engage in the process and present the budget to the Council/Board for approval.

In accordance with the NAHASDA regulations, the Indian Housing Plan (IHP) is due 75 days prior to the TRIBE/TDHE’s fiscal year end, therefore, the TRIBE/TDHE should have the IHP prepared and approved ahead of time in order for the IHP to be incorporated in the overall housing budget for the next fiscal year.

Once the budget has been approved, the Finance Director shall input the approved budget in the accounting system for the new fiscal year.",Budget Preparation Timing,8
"Program managers shall be responsible for managing transactions that are charged against their department budgets, and are accountable for ensuring their department revenues and expenses posted against their department budget are accurate, and are responsible for providing justifications on budget variables.

The budget for specific grant awards provides a spending plan against which fiscal and program performance can be measured. Therefore, the TRIBE/TDHE’s accounting system must be set up in a manner that allows the TRIBE/TDHE to produce financial reports that compare expenditures with budget amounts in compliance with the Federal award agreement.",Budget Management and Report,8
"The TRIBE/TDHE’s purchases shall be governed by its Council/Board approved procurement policy, which establishes guidelines to ensure reasonable buying practices and competition, quality and integrity.",PURCHASE OF GOODS AND SERVICES,8
"As the recipient of federal awards, the TRIBE/TDHE bases its allowable cost principles on Subpart E of the Uniform Grant Guidance and shall expend IHBG funds only for activities that are expressly approved in the Indian Housing Plan (IHP). No moneys shall be expended for activities that are unallowable or that are included as a cost of any other federally-funded program in either the current or a prior year.

The total cost of a federal award is the sum of the allowable direct and allocable indirect costs, less any applicable credits.",ALLOWABLE COSTS,8
"In determining the allowable costs for federal awards, the TRIBE/TDHE must apply the following criteria to costs:

• Be necessary, reasonable, and allocable;

• Conform to any limitations or exclusions ;

• Be consistent with policies and procedures;

• Apply treatment of cost consistently;

• Generally be treated in accordance with generally accepted accounting principles (GAAP);

The TRIBE/TDHE must adequately document costs to include, compliance with statutory and national policy requirements and be able to prepare reports that measures performance (for example, SF-425 and the Annual Performance Report (APR).

The NAHASDA program specifically excludes certain costs, and therefore, no costs associated with these activities shall be charged to the program. These exceptions are listed at 1000.26(a).

The TRIBE/TDHE shall have written procedures for determining the allowability of costs that comply with the terms and conditions of the federal award as outlined in this section.",General,9
"Capital assets means tangible or intangible assets used in operations having a useful life of more than one year which are capitalized in accordance with GAAP. Capital assets include:

• Land, buildings (facilities), equipment, and intellectual property (including software) whether acquired by purchase, construction, manufacture, lease-purchase, exchange, or through capital leases; and

• Additions, improvements, modifications, replacements, rearrangements, reinstallations, renovations or alterations to capital assets that materially increase their value or useful life (not ordinary repairs and maintenance).

The TRIBE/TDHE shall comply with its capital asset policy and procedures that provides guidance for employees to manage and safeguard the TRIBE/TDHE’s capital assets, including active management of assets with processes in place for tracking additions through purchases and donations, disposition, and depreciation.",13. CAPITAL ASSETS,9
"Donated assets shall be recorded at their fair market value (FMV) at the time of donation. The TRIBE/TDHE may depreciate the donated asset, but is prohibited from charging the value of the donated item, or costs associated with the donated asset to the federal award.

Depreciation of assets is allowable using the straight-line method. Any other depreciable method used by the TRIBE/TDHE must be pre-approved by HUD.

Adjustments for depreciation should be made as necessary, and tracked with a capital asset depreciation schedule. At a minimum, the schedule should include: Capital asset classification (for example, Land, Equipment, Building), description of the assets, initial costs or FMV of the donated asset, depreciable life, date purchased, accumulated depreciation, current year depreciation, and net asset value at the end of the year.",General,10
"I. Physical assets, such as property and equipment, are an integral part of the operation of the TRIBE/TDHE and shall be safeguarded in much the same manner as cash assets.

II. All Department property and equipment shall be stored in a secure place.

III. The Finance Department of the TRIBE/TDHE shall maintain a property ledger in the book of accounts of the Department, which shall include a list of all capitalized items for inventory control purposes.

IV. Detailed records of individual capital assets shall be kept and periodically (at least annually) balanced with the general ledger accounts.

V. All property and equipment owned by the TRIBE/TDHE (other than real estate) shall be divided into two categories: Expendable items or Non-expendable items, defined as follows:

i. Expendable items are purchased or donated items having a useful life of less than twelve (12) months and costing less than $5,000.00, and can be expended.

ii. Non-expendable items are purchased or donated items having a useful life of more than twelve (12) months and costing more than $5,000.00.

VI. The Finance Director of the TRIBE/TDHE or his/her designee for budgeting and financial control purposes shall capitalize non-expendable items.",CAPITALIZATION PROCEDURES,10
"Detailed records of individual capital assets shall be kept and periodically (at least annually) balanced with the general ledger accounts. Adjustments for depreciation should be made as necessary.

VII. The TRIBE/TDHE shall make a physical inventory of all equipment and property (other than real estate) at least annually, which shall be reconciled to the general ledger accounts.",General,11
"I. The TRIBE/TDHE shall maintain a property ledger for all units developed and improvements made to real estate in order to ensure that amounts expended comply with applicable Total Development Costs (""TDC"") and/or Dwelling Construction and Equipment (""DC&E"") requirements. The amount of IHBG assistance (including TDC, DC&E and/or any amounts expended on repair and modernization) shall be tracked for useful life purposes.

II. The TRIBE/TDHE shall track and determine whether the income derived from units developed under the 1937 Housing Act should be classified as program income upon conveyance of each unit. Income shall be classified as program income if the rehabilitation and modernization costs attributed to any unit developed under the 1937 Housing Act exceeded forty percent (40%) of the DC&E amount of such unit.",b) REAL PROPERTY PROCEDURES,11
"The TRIBE/TDHE shall have a financial audit completed annually by a certified, external, independent accounting firm, unless the TRIBE/TDHE is required by constitution or statute, to undergo audits biennially. The Finance Director shall have direct responsibility in overseeing the implementation of the audit. The selection of an auditor shall be competitively procured using the Request for Proposal (RFP) method with the objective of obtaining a high quality audit, and the selected audit firm must provide a peer review report as part of the selection process.

The Executive Director and the Finance Director shall make available the completed audit report to the Council/Board. The auditors shall present the audit to the Council/Board for the Council/Board to approve and accept.

The audit shall meet the Generally Accepted Government Auditing Standards (GAGAS) and comply with the audit requirements under Title 2 Part 200 of the Uniform Grant Guidance. The TRIBE/TDHE’s audit shall include audit of the TRIBE/TDHE’s federal, state, and local government funded programs expended during the audit period.",14. AUDIT,11
"a. Single Audit: If the TRIBE/TDHE expends $750,000 or more of federal funds during the fiscal year, it is subject to a single audit and must comply with the scope of audit within the Uniform Grant Guidance where auditor shall test for the TRIBE/TDHE’s:

I. Compliance with the requirements of the federal program, and

II. Internal Control over the compliance of the program.

b. Audit Findings and follow-up: The TRIBE/TDHE shall submit the audit to HUD with the Annual Performance Report (“APR”). The TRIBE/TDHE shall develop a plan to correct all deficiencies (if any) noted in the audit and shall implement sufficient and appropriate corrective actions in order to preclude repeat findings in subsequent audits. The TRIBE/TDHE shall be required to describe in the audit document, reasons for the reoccurrence of the finding, planned corrective action, and any partial corrective action taken.

c. Report Submission: The audit shall be submitted to the Federal Audit Clearinghouse (FAC) within thirty (30) days after receipt of the auditor’s report, or nine (9) months after the end of the audit period, whichever is earlier.

d. The TRIBE/TDHE may opt not to authorize the FAC to make the reporting package publicly available on a website. If the TRIBE/TDHE chooses this option, it shall be responsible for submitting the reporting package directly to any pass-through entities through which it has received a Federal award and to pass-through entities for which the summary schedule of prior audit findings reported the status of any findings related to Federal awards that the pass-through entity provided.",General,12
"The TRIBE/TDHE is authorized to maintain a petty cash fund of $_____. The purpose of the fund is to have a small amount of cash available for paying small amounts owed, rather than writing a check. The petty cash shall be in the safekeeping of the designated custodian who shall keep track of payouts from the fund with receipts. At all times, the amount of cash on hand and the receipts must total the amount of authorized petty cash. When the cash in the petty cash fund is low, the custodian shall request a check to replenish the cash that has been paid out. The fund shall be subject to surprise audits.",15. PETTY CASH,12
The administration and investment of the TRIBE/TDHE’s Indian Housing Block Grant (IHBG) requires the establishment of bank and investment accounts which can only be accessed through the Electronic Line of Credit Control System,16. BANKING AND INVESTING SERVICES,12
"(eLOCCS). HUD prescribes specific procedures for a TRIBE/TDHE to set up a bank account and investment accounts with a bank or a broker/dealer. These are: Banking and services shall be arranged through competitive solicitation, when practical under the circumstances. The depository must be a financial institution that is sufficiently insured by the Federal Deposit Insurance Corporation (""FDIC"") or National Credit Union Share Insurance Fund (""NCUSIF""). The following HUD forms shall be executed when receiving HUD funds for the following purposes:",General,13
